2025-12-01 00:37:52 - INFO - ======================================================================
2025-12-01 00:37:52 - INFO - 로그 파일: E:\AI Study\krx_alertor_modular\logs\backtest\phase3_train_val_test_20251201_003752.log
2025-12-01 00:37:52 - INFO - 시작 시간: 2025-12-01 00:37:52
2025-12-01 00:37:52 - INFO - ======================================================================
2025-12-01 00:37:52 - INFO - ======================================================================
2025-12-01 00:37:52 - INFO - Phase 3: Train/Val/Test 3-way 분리 백테스트
2025-12-01 00:37:52 - INFO - ======================================================================
2025-12-01 00:37:52 - INFO - 목적: 과최적화 방지 + 실전 성과 예측
2025-12-01 00:37:52 - INFO - 
2025-12-01 00:37:52 - INFO - 1. 유니버스 로드
2025-12-01 00:37:52 - INFO - ----------------------------------------------------------------------
2025-12-01 00:37:52 - INFO - 유니버스 크기: 81개
2025-12-01 00:37:52 - INFO - KODEX 200 (069500) 추가 - KOSPI 대표
2025-12-01 00:37:52 - INFO - 종목 코드: ['69500', '459580', '102110', '411060', '91160', '396500', '466920', '229200', '360750', '305720']... (총 82개)
2025-12-01 00:37:52 - INFO - 
2025-12-01 00:37:52 - INFO - 2. 가격 데이터 로드
2025-12-01 00:37:52 - INFO - ----------------------------------------------------------------------
2025-12-01 00:37:52 - INFO - 기간: 2022-01-01 ~ 2025-12-01
2025-12-01 00:37:52 - INFO - 데이터 로딩 중...
2025-12-01 00:37:53 - INFO - ✅ 데이터 로드 완료
2025-12-01 00:37:53 - INFO -    Shape: (41512, 8)
2025-12-01 00:37:53 - INFO - 
종목별 데이터 수:
2025-12-01 00:37:53 - INFO -   평균: 704일
2025-12-01 00:37:53 - INFO -   최소: 308일
2025-12-01 00:37:53 - INFO -   최대: 1380일
2025-12-01 00:37:53 - INFO - 
2025-12-01 00:37:53 - INFO - 3. 전략 설정
2025-12-01 00:37:53 - INFO - ----------------------------------------------------------------------
2025-12-01 00:37:53 - INFO - 기본 파라미터 사용:
2025-12-01 00:37:53 - INFO -   ma_period: 60
2025-12-01 00:37:53 - INFO -   rsi_period: 14
2025-12-01 00:37:53 - INFO -   rsi_overbought: 70
2025-12-01 00:37:53 - INFO -   maps_buy_threshold: 0.0
2025-12-01 00:37:53 - INFO -   maps_sell_threshold: -5.0
2025-12-01 00:37:53 - INFO - ✅ 전략 초기화 완료
2025-12-01 00:37:53 - INFO - 
2025-12-01 00:37:53 - INFO - 4. Train/Val/Test 분리 백테스트
2025-12-01 00:37:53 - INFO - ----------------------------------------------------------------------
2025-12-01 00:37:53 - INFO - 
4.1 기간 분리 확인 (70/15/15)
2025-12-01 00:37:53 - INFO - ----------------------------------------
2025-12-01 00:37:53 - INFO -   Train: 2022-01-01 ~ 2024-09-27 (1000일)
2025-12-01 00:37:53 - INFO -   Val: 2024-09-28 ~ 2025-04-29 (213일)
2025-12-01 00:37:53 - INFO -   Test: 2025-04-30 ~ 2025-12-01 (215일)
2025-12-01 00:37:53 - INFO - 
4.2 어댑터 생성
2025-12-01 00:37:53 - INFO - ----------------------------------------
2025-12-01 00:37:53 - INFO - ✅ 어댑터 생성 완료
2025-12-01 00:37:53 - INFO - 
4.3 Train/Val/Test 분리 백테스트 실행
2025-12-01 00:37:53 - INFO - ----------------------------------------
2025-12-01 00:38:56 - INFO - ✅ Train/Val/Test 분리 백테스트 완료!
2025-12-01 00:38:56 - INFO - 
2025-12-01 00:38:56 - INFO - 5. 결과 비교
2025-12-01 00:38:56 - INFO - ----------------------------------------------------------------------
2025-12-01 00:38:56 - INFO - 
2025-12-01 00:38:56 - INFO - 6. 상세 결과
2025-12-01 00:38:56 - INFO - ----------------------------------------------------------------------
2025-12-01 00:38:56 - INFO - 
[Train 결과]
2025-12-01 00:38:56 - INFO -   기간: 2022-01-01 ~ 2024-09-27
2025-12-01 00:38:56 - INFO -   수익률: 0.38%
2025-12-01 00:38:56 - INFO -   CAGR: 0.22%
2025-12-01 00:38:56 - INFO -   Sharpe: 0.10
2025-12-01 00:38:56 - INFO -   MDD: -23.59%
2025-12-01 00:38:56 - INFO -   거래 수: 978회
2025-12-01 00:38:56 - INFO -   거래비용: 947,049원 (9.47%)
2025-12-01 00:38:56 - INFO -   레짐 통계:
2025-12-01 00:38:56 - INFO -     - 상승장: 281일 (63.1%)
2025-12-01 00:38:56 - INFO -     - 하락장: 0일 (0.0%)
2025-12-01 00:38:56 - INFO -     - 중립장: 164일 (36.9%)
2025-12-01 00:38:56 - INFO - 
[Val 결과]
2025-12-01 00:38:56 - INFO -   기간: 2024-09-28 ~ 2025-04-29
2025-12-01 00:38:56 - INFO -   수익률: 4.85%
2025-12-01 00:38:56 - INFO -   CAGR: 8.54%
2025-12-01 00:38:56 - INFO -   Sharpe: 0.81
2025-12-01 00:38:56 - INFO -   MDD: -7.35%
2025-12-01 00:38:56 - INFO -   거래 수: 383회
2025-12-01 00:38:56 - INFO -   거래비용: 201,430원 (2.01%)
2025-12-01 00:38:56 - INFO -   레짐 통계:
2025-12-01 00:38:56 - INFO -     - 상승장: 0일 (0.0%)
2025-12-01 00:38:56 - INFO -     - 하락장: 228일 (84.4%)
2025-12-01 00:38:56 - INFO -     - 중립장: 42일 (15.6%)
2025-12-01 00:38:56 - INFO - 
[Test 결과]
2025-12-01 00:38:56 - INFO -   기간: 2025-04-30 ~ 2025-12-01
2025-12-01 00:38:56 - INFO -   수익률: 58.22%
2025-12-01 00:38:56 - INFO -   CAGR: 148.63%
2025-12-01 00:38:56 - INFO -   Sharpe: 4.35
2025-12-01 00:38:56 - INFO -   MDD: -9.52%
2025-12-01 00:38:56 - INFO -   거래 수: 230회
2025-12-01 00:38:56 - INFO -   거래비용: 318,609원 (3.19%)
2025-12-01 00:38:56 - INFO -   레짐 통계:
2025-12-01 00:38:56 - INFO -     - 상승장: 182일 (74.9%)
2025-12-01 00:38:56 - INFO -     - 하락장: 0일 (0.0%)
2025-12-01 00:38:56 - INFO -     - 중립장: 61일 (25.1%)
2025-12-01 00:38:56 - INFO - 
2025-12-01 00:38:56 - INFO - 7. 최종 판정
2025-12-01 00:38:56 - INFO - ----------------------------------------------------------------------
2025-12-01 00:38:56 - INFO - ✅ ✅ 📈 개선 (시장 환경 호전)
2025-12-01 00:38:56 - INFO -   검증 신뢰도: low
2025-12-01 00:38:56 - INFO - 
⚠️ 주의사항:
2025-12-01 00:38:56 - WARNING -   ⚠️ Val/Test 차이 큼: 1641.4%
2025-12-01 00:38:56 - INFO - 
2025-12-01 00:38:56 - INFO - 8. 결과 저장
2025-12-01 00:38:56 - INFO - ----------------------------------------------------------------------
2025-12-01 00:38:56 - INFO - ✅ 결과 저장: E:\AI Study\krx_alertor_modular\data\output\backtest\train_val_test_split_results.json
2025-12-01 00:38:56 - INFO - ✅ 히스토리 저장: E:\AI Study\krx_alertor_modular\data\output\backtest_history.json
2025-12-01 00:38:56 - INFO - 
2025-12-01 00:38:56 - INFO - 9. 요약
2025-12-01 00:38:56 - INFO - ----------------------------------------------------------------------
2025-12-01 00:38:56 - INFO - ======================================================================
2025-12-01 00:38:56 - INFO - Phase 3: Train/Val/Test 3-way 분리 백테스트 완료
2025-12-01 00:38:56 - INFO - ======================================================================
2025-12-01 00:38:56 - INFO - 
📊 성과 비교:
2025-12-01 00:38:56 - INFO -   Train CAGR: 0.22%
2025-12-01 00:38:56 - INFO -   Val CAGR:   8.54%
2025-12-01 00:38:56 - INFO -   Test CAGR:  148.63%
2025-12-01 00:38:56 - INFO - 
📋 판정: 📈 개선 (시장 환경 호전)
2025-12-01 00:38:56 - INFO -    검증 신뢰도: low
2025-12-01 00:38:56 - INFO - ======================================================================
2025-12-01 00:38:56 - INFO - 
2025-12-01 00:38:56 - INFO - ======================================================================
2025-12-01 00:38:56 - INFO - 종료 시간: 2025-12-01 00:38:56
2025-12-01 00:38:56 - INFO - ======================================================================
